{"schema_version": 1, "nav_id": "nav_hostelroomac", "transform_scene": "scn_hostelroomac", "cell_m": 0.05, "origin": [-3.155, -1.993], "width": 128, "height": 79, "agent_radius_m": 0.25, "free_bits_b64": "AAAAAAAAAAAAAAAAAAAAAAAAAAAAAAAAAAAAAAAAAAAAAAAAAAAAAAAAAAAAAAAAAAAAAAAAAAAAAAAAAAAAAAAAAAAAAAAAAAAAAAAAAAAAAAAAAAAAAAAAAAAAAAAAAAAAAAAAAAAAAAAAAAAAAAAAAAAAAAAAAAAAAAAAAAAAAAAAAAAAAAAAAAAAAAAAAAAAAAAAAAAAAAAAAAAAAAAAAAAAAAAAAAAAAAAAAAAAAAAAAAAAAAAAAAAAAAAAAAAAAAAAAAAAAAAAAAACAAAAAAAAAAAAAAAAAAAAAgAAAAAAAAAAAAAAAAAAAAMAAAAwAAAAAAAAAAAAAAADAAAAMAAAAAAAAAAAAAAAAwAAADAAAAAAAAAAAAAAAAMAAAAwAAAAAAAAAAAAAAADAAAAMAAAAAAAAAAAAAAAAwAAABgAAAAAAAAAAAAAAAOAAAAcAAAAAAAAAAAAAAAHAAAAHAAAAAAAHAAAAAAADwAAABwAAAAAAfwAAAAAAH8AAAAcAAAAAAH8AAAAAAD/AAAAHAAAAAAB/AAAAAAH/wAAABwAAAAAAfwAAAAAf/8AAAAcAAAAAAH8AAAAAH//AAAADAAAAAAB/AAAAAD//wAAAA4AAAAAAf4AAAAB//8AAAAPAAAAAAH8AAAAA///AAAAD8AAAAAB/AAAAAP//wAAAA/4AAAAAfwAAAAD//8AAAAf/wAAAAH8AAAAAf//AAAAP/8AAAAB/AAAAAH//wAAAH//AAAAAfwAAAAB//8AAEP//wAAAAH8AAAAAf/+AAD///+AAAAB/AAAAAH//gAA////gAAAAfwAAAAD//4AAP///4AAAAH8AAAAB//+AAB///+AAAAB/gAAAAf//gAAf///wAAAA/8AAAAP//4AAD///+AAAAf/gAAAH///AAA////wAAAP//AAAH///wAAP////gAAf////+P///8AAAH/////////////////AAAAP////////////////wAAAB////////////////8AAAAP////////////////AAAAD////////////////wAAAA////////////////8AAAAP////////////////AAAAD////+///////////wAAAA////4B/j////////4AAAAP///wAGAH/Cf////8AAAAD///4AAAAAAA////+AAAAA///8AAAAAAAD////AAAAAP///AAAAAAAAf///wAAAAD//8AAAAAAAAD///8AAAAA//4AAAAAAAAA//n/AAAAAf/8AAAAAAAAAAPADgAAAAD8eAAAAAAAAAAAAAAAAAAAYAAAAAAAAAAAAAAAAAAAAAAAAAAAAAAAAAAAAAAAAAAAAAAAAAAAAAAAAAAAAAAAAAAAAAAAAAAAAAAAAAAAAAAAAAAAAAAAAAAAAAAAAAAAAAAAAAAAAAAAAAAAAAAAAAAAAAAAAAAAAAAAAAAAAAAAAAAAAAAAAAAAAAAAAAAAAAAAAAAAAAAAAAAAAAAAAAAAAAAAAAAAAAAAAAAAAAAAAAAAAAAAAAAAAAAAAAAAAAAAAAAAAAAAAAAAAAAAAAAAAAAAAAAAAAAAAAAAAAAAAAAAAAAAAAAAAAAAAAAAAAAAAAAAAAAAAAAAAAAAAAAAAAAAAAAAAAAAAAAAAAAAAAAAAAAAAAAAAAAA==", "layers": {"y0_m": 0.1, "dy_m": 0.1, "count": 28, "occupied_bits_b64": "///////////////////////////////////////////////////////////////////////////////////////////////////////////44AYAA0AAAAjAAAYEOD4//dgGAAMAAAVIAAAH//8AP/vQBgADAAAPWAAABxABAD/5GAf8BgAAs9uAAAcQAQA/+IAH/C4AAOCAwAAVEBEAP/jABjQyAAdgAMAAD4AxAD/4+AAAAAACAAAAAAuAAQA/+LAAAAAAAAAAAAA/gDkAP/h4AAEAAAAAAAAAPwB9AD/4GAABAAAABhgAAD4AfwA/+DgAAQAAAAYwAAAKAH8AP/v4AAFAAAAAIAAABgB9AD/8+AAYwEAAAAAAAAH//wA//fgAGMBAAAAAAAAJ//8AP/r4AApAQAAAAAAABYAAAD/6+AADAAAAAAAAAAHgAAA/+PgABMAAAAAAAAAD8AAAP//4AA+AAAAAAAAAB/AAAD/5+AAZwAAAAAAAAAPQAAA/+PwAG8AAAAAAAAADkAAAP/i8AB+AAAIAAAAAAcAAAD/4fgAPAAAIAAAAAAAAAAA/+H4AAoAACAAAAAAAAAAAP/l+AAAABAAAAAAAAAAAAD/5/AAAAAQAAAAAAAAAAAA///gAAYA8AAAAAAAAAAAAP/gAAAAAPAAAAAAAAAAAAD/4AAAAA8CAAAAAAAAAAAA/+AAAAAOAQAAAAAAAAAAAP/gAAAADQGAAAAAAAAAAAD/4AAACA5BgAAAAAIEAAAA/+AAAAAf54AAAAAYCAAAAP/gAAAkD/8AAAA///AAAAD/4AAAEA///gAAIP/wAAAA/+AAAAAALAAAAAAAAAAAAP/gAAAAAAAAAAAAAAAAAAD/4AAAAAAAAAAAAAAAAAAA/+AAAAAAAAAAAAAAAAAAAP/gAAAAAAAAAAAAAAwAAAD/4AAAAAAAAAAAAAAeAAAA/+AAAAAAAAAAAAAACgAAAP/gAAAAAAAAAAAAAAAAAAD/4AAAAAAAAAAAAAAAAAAA/+AAAAAAAAAAAAAAAAAAAP/gAAAAAAAAAAAAAAAAAAD//+AAAAAAAAAAAAAAAAAA///gAAAAAAAAAAAAAAAAAP/v4AAAAAAAAAAAAAAAAAD/5+AAAAAAAAAAAAAAAAAA//9gAAAAAAAAAAAAAAAAAP/34AAAAAAIAAAAAAAAAAD//+AAAAAAHgAAAAAAAAAA///gAAAAAP4AAAAAAAAAAP/34AAAAAb/AAAAAAAAAAH/++AAAwAP/wAAAAAAAAAB//vgAAKAAv8AAAAIAAAAAf//4AABgAL/AAAACAAAAAH//eAAAgQGb8ABAAgAAAAH/+PgAAAEBvmAAQfIAAAAD//n4AAAHAPwAAACuAAAAA//4+AAAB5n4AAAAPgDAAAO/+PgAOAAZtgAAAD8I4HGHP/v4ADgAD+YAAAAPiGP//7/7+AACAAuQAAAAHxvj/////vgAB/5/gAAAAAt8ArgD///4YPf+QgAAAAACPBxYA3/7+fP6AAAAAAAAAgj+QAP/+fn/DhjgAAAAAAMQyAAD//j73g54UAAAAAAACEAAA///////////////////////////////////////////////////////////////////////////////////////////////////////////////////////////////////////////////////////////////////////////////////////////////////////////////////////+MAAAAAAAAA4BIAAAAA/P/jgAAAAAAAB/AAABgABHD/4AAAQAAAAABwAAAAAAAA/+AAEMAAAAAAIAAAIGAAAP/gABjBgAABAAMAACBgwAD/4AAYgIAAAQADMAAwAMAA/+AAAIEAAAAAAjgAcAAAAP/jwAABAgAAAAAgABgA4AD/48AAAAIAABAAMAAQAfAA/+PAAAAAAAAY4CAAEAHwAP/j4AAAAAAAGMAgABAB+AD/4WAAAQIAAAAAIAAQAfAA/+AAAGODgAAAADAAGADkAP/hoABjA4AAAAAwABgABAD/46AAIgAAAAAAMAAXgAAA/+AAABwAAAAAADAAP8AAAP/xAAA+AAAAAAAwABngAAD/8QAAfwIAAAAAMAAb4AAA/+4gAGMCAAAAADAAHGAAAP//4ABnAgAQAAAwAAzAAAD//+AAfwcACAAAIAAPwAAA/+/wAH8GADgAADAAAwAAAP/n8AAcAgAkAAAgAAAAAAD/5+AAAAIDAAAAIAAAAAAA/+fAAAACAAAAADAAAAAAAP/h4AAAAgAAAAAgAAAAAAD/4AAAAAIAAAAAMAAAAAAA/+AAAAAPAAAAADAAABwAAP/gAAAADwAAAAAwAAB8AAD/4AAAAA8AAAAAIAAAaAAA/+AAAAAPAAAAABgCBwAAAP/gAAAAD/TAAAAwgn4AAAD/4AAAAA++4gAAMYZwAAAA/+AAAAAGtMIAADGGMAAAAP/gAAAAAAAAAAAAAAAAAAD/4AAAAAAAAAAAAAAAAAAA/+AAAAAAAAAAAAAAAQAAAP/gAAAAAAAAAAAAAAeAAAD/4AAAAAAAAAAAAAAOAAAA/+AAAAAAAAAAAAAAAAAAAP/gAAAAAAAAAAAAAAAAAAD/4AAAAAAAAAAAAAAAAAAA/+AAAAAAAAAAAAAAAAAAAP/gAAAAAAAAAAAAAAAAAAD/4AAAAAAAAAAAAAAAAAAA//5gAAAAAAAAAAAAAAAAAP/6AAAAAAAAAAAAAAAAAAD//wAAAAAAAAAAAAAAAAAA//AAAAAAAAAAAAAAAAAAAP/wAAAAAAAAAAAAAAAAAAD/4AAAAAAAAAAAAAAAAAAA/+AAAAAAAAAAAAAAAAAAAP/jwAAAAABAAAAAAAAAAAD//8AAAAAGcAAAAAAAAAAB//OAAAAABn4AAAAAAAAAAf/5wAAAAAJ/A//fOAAAAAH/++AAAAAD///f/7gAAAAB//HgAAAAAPDoZztAAAAAAf/gAAAAAAAgADAwWAAAAAP/4eAAAAwGYAAAABgAAAAP/+fAAAAcT4AAAAAAAAAAD///gADgHG8AAAAAOCOAxg///wAA4AH+gAAAABRjjucP/+AAAAgAXgAAAAAcWQ87D//gAAAIBE4AAAAABFDigAP/4AHjgAAEAAAAAEAAcIAA/+AD/+BIAAAAAAAAAAAAA//gDfxwTAAAAAAACAAAAAf/4Ax4MGoAAAAAAAQAAgBA///////////////////////////////////////////////////////////////////////////////////////////////////////////////////////////////////////////////////////////////////////////////////////////////////////////////////////gAAAAAIAADWA8ADHAAfz/4AAAAAYAAAHgOAAYwET8/+AAAAACAAABMCAAEOZgAP/gAAAABgAAABAwADBhwAD/4AAY144AAAATYAAQd8AA/+AAGOOOAAUAIzAAEAOAAP/gAADzxwAG4HA4ABgAAAD/4AAA14aAB6AwOAAYAAAA/+AAAPWGgAY68DgAEAAAAP/hAAD5RgAGH+AwABAAYAD/4eAA/8YABgvAMAA4AOAA/+LgAPeGAAYAADAAOAAAAP/gYAD/hoAGAAAwABgABAD/4CAAKwcABgAAIYAYAAQA/+BgAAAGAAYAADBAH4AAAP/gYAAIBhAGAAA0QB/AAAD/4AAAPgcQDwAAMAAf4AAA/+AAAHIHKB8AADgAHeAAAP/8AABDBiAGAAA8ABjgAAD/52AAQQYYPwAA+AAYwAAA/+cAAAMGID8AAPgAH8AAAP/m4ABmBiAmAABwAA+AAAD/4EAAHAYCbgAAcBg4AAAA/+FAAAAGCeYAADwACAAAAP/x4AAABgTOAAAyAggAAAD/+OAAAAYLPgAAOAAIAAAA/+AAAAAGAT4AADgACAAAAP/gAAAAB4MOAAA8AAgAAAD/4AAAAAYCDwAAOAAIAAAA/+AAAAAGIA8AADAAGAAAAP/gAAAABiiOAAAwAigAAAD/4AAAAAew7gAAOOA4AAAA/+AAAAAH//4AAD//+AAAAP/gAAAAB///AAA//jAAAAD/4AAAAAAAAAAAAAAAAAAA/+AAAAAAAAAAAAAAAAAAAP/gAAAAAAAAAAAAAAAAAAD/4AAAAAAAAAAAAAAAAAAA/+AAAAAAAAAAAAAAAAAAAP/gAAAAAAAAAAAAAAAAAAD/4AAAAAAAAAAAAAAAAAAA/+AAAAAAAAAAAAAAAAAAAP/gAAAAAAAAAAAAAAAAAAD/4AAAAAAAAAAAAAAAAAAA/+AAAAAAAAAAAAAAAAAAAP/kYAAAAAAAAAAAAAAAAAD/8AAAAAAAAAAAAAAAAAAA//AAAAAAAAAAAAAAAAAAAP/4AAAAAAAAAAAAAAAAAAD/8AAAAAAAAAAAAAAAAAAA//AAAAAAAAAAAAAAAAAAAP/0AAAAAAAAAAAAAAAAAAD/6AAAAAAAAAAAAAAAAAAB//AAAAAAAAAAAAAAAAAAAf/0AAAAAAA8AAAAAAAAAAH/6AAAAAAD//////gAAAAB//QAAAAAA//////4AAAAAf/gAAAAAAP/////+AAAAAH/4AAAAAADmAQBvvgAAAAA/+DgAAAEAxAFAAgYAAAAAP/3QAAAP89ABgAAWAAAAAH/7AAAAD/vgAAAAFg6AUQB/+wAAAB87wAAAAAcf4//D//gAAAISB8AAAAAHv//3w3/4AAAAH8XAAAAABuo9IeA/+ADw4B1mgAAAAAYAHABwP/gB//gZ5gAAAAATgA4AsL/4Aw+cHsAAAAAAFwAIAAD/+AIPHB/wgAAAAAEAAAGQP//////////////////////////////////////////////////////////////////////////////////////////////////////////////////////////////////////////////////////////////////////////////////////////////////////////////////////4OAAAAP+/gEAeAnx4EAA/+DgAAAD/3wf4Hg/+PAkAP/h4AAAA//+H/B///DoYAD/4WAAAAO9/i/wf//48aAA/+DgCH8P//5v83//8HDgAP/k4Bj/j///f/N///h/8AD//GAA/4f//nOwf//4PoAA//xgAPWH/vzx8H//+DAAAP/kIADwx//8/fA///gAAAD/5eAA+Mf//n/gP//4AGAA/+DgAP/H//wfgD//+ADgAP/h4AD/h//8EAA///gAAAD/4OAAf4f//AAAP//4AAQA/+bgAD4H//4AAD//+AAEAP/oYAAAB//+AAA///gAAAD/4OAAAAf//gAAP/34AAAA/+DgAAAH//wAAD/4+AAAAP/g4AAAB//+AAA/+PngAAD/4WAAAAf//AAAP/j4YAAA/+BgAAAH//wAAD/p+MAAAP/gYAAAB//8AAA/6/mAAAD/4GAAAAf//AAAP//4AAAA//hgAAAH//wAAD/3+AAAAP/w4AAAB//8AAA//fgAAAD/+OAAAAf//AAAP/34AAAA///gAAAH/vwAAD/9+AAAAP/gAAAAB/98AAA///wAAAD/4AAAAAf/vAAAP//4AAAA/+AAAAAH/zwAAD//+AAAAP/gAAAAB//8AAA///wAAAD/4AAAAAf/fAAAP//8AAAA/+AAAAAH//wAAD///AAAAP/gAAAAB//8AAA///wAAAD/4AAAAAc/+wAAP/9wAAAA/+AAAAACBgAAAAAAAAAAAP/gAAAAAAAAAAAAAAAAAAD/4AAAAAAAAAAAAAAAAAAA/+AAAAAAAAAAAAAAAAAAAP/gAAAAAAAAAAAAAAAAAAD/4AAAAAAAAAAAAAAAAAAA/+AAAAAAAAAAAAAAAAAAAP/gAAAAAAAAAAAAAAAAAAD/4AAAAAAAAAAAAAAAAAAA/+AAAAAAAAAAAAAAAAAAAP/gAAAAAAAAAAAAAAAAAAD/4GAAAAAAAAAAAAAAAAAA/+BgAAAAAAAAAAAAAAAAAP/gYAAAAAAAAAAAAAAAAAD/4GAAAAAAAAAAAAAAAAAA/+BgAAAAAAAAAAAAAAAAAP/gYAAAAAAAAAAAAAAAAAD/4GAAAAAAAAAAAAAAAAAA/+BwAAAAAAAAAAAAAAAAAP/wYAAAAAAAAAAAAAAAAAD/4GAAAAAAAAAAAAAAAAAA/+BgAAAAAgAAAAAIAAAAAP/gYAAAAAL////gGAAAAAD/4GAAAAAD//////gAAAAA/+DgAAAAA//////4AAAAAP/g4AAABAP//////AABgAD/4GAAAD/D//////8AA8AA/+BgAAA/4////xH798fEAP/gcAAAf3vy///ANfeP/Az/4PAACH5/4f//gB/z7+8M/+BwAAh898P//wA5oe8vwP/gcAOAfvfg//+AOID2M8D/4PAH4HkDw//+QbgAYA/A/+BgDmB4A0H//wBcACAEwP/gOBwwfkfA//0AMABgAMD//////////////////////////////////////////////////////////////////////////////////////////////////////////////////////////////////////////////////////////////////////////////////////////////////////////////////////+AAAAAAAAAAAB//gPAAAP/gAAAAAAIAAAAf/6h8AAD/4AAAAAACAAAAP//gPGAA/+BgAAAAdAAYABgCAD/gAP/gYAgACFgADAMAAgA/YAD/4eAYAAgZAQwDAAYAP8AA/+AgAAAAAPAWAAACAB4AAP/gIAAAAABwNoAABgAAAAD/4CAAAAAA0HywAAOYAAAA/+ZgAAAAAHB/4AAByAAAAP/kYACAQAAQf4AAA4AAAAD/4OAAkMAAIDAAAAOAAAAA/+BgAL6AAAAAAAAHiAAEAP/jYAA+AAAAAAAAB4gABAD/4GAAAAAKAAAAAAeAAAAA/+AgAAAADIAAAAAfgAAAAP/gYAAAAAaAAAAAH8AAAAD/4CAAAAAHgAAAAB/AAAAA/+WgAAAADyAAAAA/wAAAAP/nYAAAAAdAAAAAf8AAAAD/4DAAAAAFwAAAAH/AAAAA/+BgAAAAAAAAAAB/4AAAAP/gYAAAAAAAAAAAf8AAAAD/4mAAAAADwAAAAD9AAAAA/+9gAAAAB+AAAAA/wAAAAP/34AAAAA/4AAAAH8AAAAD/4AAAAAAP+AAAAB+AAAAA/+AAAAAAD/gAAAAfAAAAAP/gAAAAAB/4AAAADAAAAAD/4AAAAAAd+AAAAB4AAAAA/+AAAAAAH/gAAAAegAAAAP/gAAAAAB/4AAAbf4AAAAD/4AAAAAA/8AAAP//wAAAA/+AAAAAGG+IAAD/+MAAAAP/gAAAAAgAAAAAAAAAAAAD/4AAAAAAAAAAAAAAAAAAA/+AAAAAAAAAAAAAAAAAAAP/gAAAAAAAAAAAAAAAAAAD/4AAAAAAAAAAAAAAAAAAA/+AAAAAAAAAAAAAAAAAAAP/gAAAAAAAAAAAAAAAAAAD/4AAAAAAAAAAAAAAAAAAA/+AAAAAAAAAAAAAAAAAAAP/gAAAAAAAAAAAAAAAAAAD/4AAAAAAAAAAAAAAAAAAA/+BwAAAAAAAAAAAAAAAAAP/gcAAAAAAAAAAAAAAAAAD/4HAAAAAAAAAAAAAAAAAA/+DgAAAAAAAAAAAAAAAAAP/g4AAAAAAAAAAAAAAAAAD/4GAAAAAAAAAAAAAAAAAA/+BgAAAAAAAAAAAAAAAAAP/gcAAAAAAAAAAAAAAAAAD/4GAAAAAAAAAAAAAAAAAA/+BwAAAAAAAAAAAAAAAAAP/gcAAAAAIAA